{
  "$schema": "guided-workflow.schema.json",
  "workflow": {
    "id": "artemis-guided-configuration",
    "name": "Artemis Guided Configuration Workflow",
    "version": "0.2.0",
    "defaultTemplateId": "custom-configuration"
  },
  "useCaseTemplates": [
    {
      "id": "minimal-teaching-setup",
      "label": "Minimal teaching setup",
      "description": "Starts with the common course workflow, communication, and core exercise infrastructure.",
      "selectedFeatureIds": [
        "course-workflow",
        "communication",
        "exercise-common",
        "programming",
        "quiz"
      ],
      "deselectedFeatureIds": [
        "athena",
        "iris",
        "hyperion",
        "lti",
        "theia",
        "apollon",
        "sharing"
      ],
      "recommendedStepIds": [
        "configuration-goal",
        "teaching-content",
        "exercise-types",
        "review-and-consequences",
        "artifact-generation"
      ],
      "consequences": [
        "Keeps the deployment close to the default teaching and exercise setup.",
        "Leaves optional AI and integration features disabled until explicitly selected."
      ],
      "warnings": []
    },
    {
      "id": "programming-course",
      "label": "Programming course",
      "description": "Emphasizes programming exercises, common exercise infrastructure, and optional online IDE support.",
      "selectedFeatureIds": [
        "course-workflow",
        "communication",
        "exercise-common",
        "programming",
        "quiz",
        "text",
        "fileupload"
      ],
      "deselectedFeatureIds": [
        "athena",
        "iris",
        "hyperion",
        "lti",
        "apollon",
        "sharing"
      ],
      "recommendedStepIds": [
        "configuration-goal",
        "teaching-content",
        "exercise-types",
        "ai-and-integrations",
        "review-and-consequences",
        "artifact-generation"
      ],
      "consequences": [
        "Keeps programming exercises enabled for code-based assignments."
      ],
      "warnings": [
        "Programming exercise execution still depends on CI and VCS infrastructure outside this functional model."
      ]
    },
    {
      "id": "exam-focused-course",
      "label": "Exam-focused course",
      "description": "Starts with exam and plagiarism support for assessment-heavy courses.",
      "selectedFeatureIds": [
        "course-workflow",
        "communication",
        "exercise-common",
        "programming",
        "quiz",
        "exam",
        "plagiarism"
      ],
      "deselectedFeatureIds": [
        "athena",
        "iris",
        "hyperion",
        "lti",
        "theia",
        "apollon",
        "sharing"
      ],
      "recommendedStepIds": [
        "configuration-goal",
        "teaching-content",
        "exercise-types",
        "assessment-and-integrity",
        "review-and-consequences",
        "artifact-generation"
      ],
      "consequences": [
        "Enables exam workflows and plagiarism checks.",
        "Keeps AI assistance disabled by default for assessment-sensitive setups."
      ],
      "warnings": []
    },
    {
      "id": "course-with-lecture-materials",
      "label": "Course with lecture materials",
      "description": "Starts with lecture and tutorial group support for material-centered teaching.",
      "selectedFeatureIds": [
        "lecture",
        "tutorialgroup",
        "course-workflow",
        "communication",
        "exercise-common",
        "programming",
        "quiz"
      ],
      "deselectedFeatureIds": [
        "athena",
        "iris",
        "hyperion",
        "lti",
        "theia",
        "apollon",
        "sharing"
      ],
      "recommendedStepIds": [
        "configuration-goal",
        "teaching-content",
        "exercise-types",
        "review-and-consequences",
        "artifact-generation"
      ],
      "consequences": [
        "Highlights lecture management and tutorial groups.",
        "Keeps basic exercise support available for assignments around lecture content."
      ],
      "warnings": []
    },
    {
      "id": "ai-enabled-course",
      "label": "AI-enabled course",
      "description": "Starts with the standard course setup plus Iris, Athena, Atlas, and Hyperion decisions.",
      "selectedFeatureIds": [
        "course-workflow",
        "communication",
        "exercise-common",
        "programming",
        "quiz",
        "text",
        "atlas",
        "iris",
        "athena",
        "hyperion"
      ],
      "deselectedFeatureIds": [
        "lti",
        "apollon",
        "sharing"
      ],
      "recommendedStepIds": [
        "configuration-goal",
        "teaching-content",
        "exercise-types",
        "assessment-and-integrity",
        "ai-and-integrations",
        "review-and-consequences",
        "artifact-generation"
      ],
      "consequences": [
        "Enables AI and adaptive learning features that can enrich feedback and tutoring."
      ],
      "warnings": [
        "AI options are only usable when the selected deployment profile provides the required services."
      ]
    },
    {
      "id": "custom-configuration",
      "label": "Custom configuration",
      "description": "Starts from the feature model defaults and lets the user review every guided decision.",
      "selectedFeatureIds": [],
      "deselectedFeatureIds": [],
      "recommendedStepIds": [
        "configuration-goal",
        "teaching-content",
        "exercise-types",
        "assessment-and-integrity",
        "ai-and-integrations",
        "review-and-consequences",
        "artifact-generation"
      ],
      "consequences": [
        "Uses the current model defaults as the initial selection.",
        "Keeps all guided decisions visible for detailed review."
      ],
      "warnings": []
    }
  ],
  "steps": [
    {
      "id": "configuration-goal",
      "title": "Configuration Goal",
      "order": 1,
      "description": "Choose the starting goal for the configuration.",
      "decisions": []
    },
    {
      "id": "teaching-content",
      "title": "Teaching Content",
      "order": 2,
      "description": "Configure lecture material, tutorial group, course workflow, and communication features.",
      "decisions": [
        {
          "id": "teaching-content-baseline",
          "question": "Which teaching content capabilities should be available?",
          "description": "Select the course-facing content and communication features that teachers normally use.",
          "selectionMode": "multiple",
          "options": [
            {
              "id": "enable-lecture-materials",
              "status": "published",
              "label": "Enable lecture materials",
              "description": "Allow teachers to manage lectures and lecture units.",
              "selects": [
                "lecture"
              ],
              "deselects": [],
              "warnings": [],
              "enabledOutcome": [
                "Instructors can publish lecture material, organize lecture units, and connect course content with exercises.",
                "Students get one place to follow lecture-related learning resources."
              ],
              "recommendedWhen": [
                "Your course uses slides, recordings, linked resources, or lecture units alongside exercises.",
                "You want course material to stay connected to learning goals and assessments."
              ],
              "thingsToKnow": [
                "Lecture material can be enabled without adding AI or external integration features.",
                "This is useful for material-centered courses even when exercises stay simple."
              ]
            },
            {
              "id": "enable-tutorial-groups",
              "status": "published",
              "label": "Enable tutorial groups",
              "description": "Allow teachers to manage tutorial groups and related course organization.",
              "selects": [
                "tutorialgroup"
              ],
              "deselects": [],
              "warnings": [],
              "enabledOutcome": [
                "Instructors can organize tutorial groups, assign responsible tutors, and track attendance-related course organization.",
                "Students can be managed in smaller teaching groups."
              ],
              "recommendedWhen": [
                "Your course uses exercise groups, lab groups, tutorials, or recurring small-group sessions.",
                "Tutors need clear responsibility for a subset of students."
              ],
              "thingsToKnow": [
                "This option supports course organization and does not change exercise assessment behavior.",
                "It is most useful for larger courses with multiple tutors or sessions."
              ]
            },
            {
              "id": "keep-core-course-workflow",
              "status": "published",
              "label": "Keep core course workflow",
              "description": "Keep the mandatory course workflow and communication baseline selected.",
              "selects": [
                "course-workflow",
                "communication"
              ],
              "deselects": [],
              "warnings": [
                "These features are modeled as mandatory baseline capabilities."
              ],
              "enabledOutcome": [
                "Instructors can create and manage courses, participants can access course spaces, and communication remains available.",
                "Students receive the baseline course experience needed for the rest of Artemis."
              ],
              "recommendedWhen": [
                "Almost every Artemis course needs the standard course workflow and communication baseline.",